{
  "manufacturer": "lg",
  "model": "VF28",
  "aliases": [],
  "controls": [
    "many LG VCRs"
  ],
  "protocol": {
    "carrierHz": 36000,
    "minSends": 1
  },
  "keys": {
    "KEY_EJECTCD": {
      "forms": [
        {
          "id": "primary.raw",
          "type": "raw",
          "intro": [8960, 4200, 560, 560, 560, 1680, 560, 1680, 560, 1680, 560, 560, 560, 1680, 560, 1680, 560, 560, 560, 1680, 560, 560, 560, 560, 560, 560, 560, 1680, 560, 560, 560, 560, 560, 1680, 560, 560, 560, 560, 560, 560, 560, 560, 560, 560, 560, 560, 560, 560, 560, 560, 560, 1680, 560, 1680, 560, 1680, 560, 1680, 560, 1680, 560, 1680, 560, 1680, 560, 1680, 560, 85000],
          "repeat": [8960, 2240, 560, 85000],
          "confidence": "plausible",
          "source": "lirc-remotes@291b40f remotes/lg/VF28.lircd.conf:48 [block LG_VCR_Remote] (contributed by Adrien Beau): expanded to raw by lircd 0.10.2's transmit rules"
        }
      ]
    },
    "TV_Video": {
      "forms": [
        {
          "id": "primary.raw",
          "type": "raw",
          "intro": [8960, 4200, 560, 560, 560, 1680, 560, 1680, 560, 1680, 560, 560, 560, 1680, 560, 1680, 560, 560, 560, 1680, 560, 560, 560, 560, 560, 560, 560, 1680, 560, 560, 560, 560, 560, 1680, 560, 1680, 560, 560, 560, 1680, 560, 560, 560, 1680, 560, 560, 560, 560, 560, 560, 560, 560, 560, 1680, 560, 560, 560, 1680, 560, 560, 560, 1680, 560, 1680, 560, 1680, 560, 85000],
          "repeat": [8960, 2240, 560, 85000],
          "confidence": "plausible",
          "source": "lirc-remotes@291b40f remotes/lg/VF28.lircd.conf:49 [block LG_VCR_Remote] (contributed by Adrien Beau): expanded to raw by lircd 0.10.2's transmit rules; button 'TV/Video'"
        }
      ]
    },
    "TV_Mute": {
      "forms": [
        {
          "id": "primary.raw",
          "type": "raw",
          "intro": [8960, 4200, 560, 560, 560, 560, 560, 1680, 560, 560, 560, 560, 560, 560, 560, 560, 560, 560, 560, 1680, 560, 1680, 560, 560, 560, 1680, 560, 1680, 560, 1680, 560, 1680, 560, 1680, 560, 1680, 560, 560, 560, 560, 560, 1680, 560, 560, 560, 560, 560, 560, 560, 560, 560, 560, 560, 1680, 560, 1680, 560, 560, 560, 1680, 560, 1680, 560, 1680, 560, 1680, 560, 85000],
          "repeat": [8960, 2240, 560, 85000],
          "confidence": "plausible",
          "source": "lirc-remotes@291b40f remotes/lg/VF28.lircd.conf:50 [block LG_VCR_Remote] (contributed by Adrien Beau): expanded to raw by lircd 0.10.2's transmit rules"
        }
      ]
    },
    "KEY_MENU": {
      "forms": [
        {
          "id": "primary.raw",
          "type": "raw",
          "intro": [8960, 4200, 560, 560, 560, 1680, 560, 1680, 560, 1680, 560, 560, 560, 1680, 560, 1680, 560, 560, 560, 1680, 560, 560, 560, 560, 560, 560, 560, 1680, 560, 560, 560, 560, 560, 1680, 560, 560, 560, 1680, 560, 1680, 560, 560, 560, 1680, 560, 560, 560, 560, 560, 560, 560, 1680, 560, 560, 560, 560, 560, 1680, 560, 560, 560, 1680, 560, 1680, 560, 1680, 560, 85000],
          "repeat": [8960, 2240, 560, 85000],
          "confidence": "plausible",
          "source": "lirc-remotes@291b40f remotes/lg/VF28.lircd.conf:51 [block LG_VCR_Remote] (contributed by Adrien Beau): expanded to raw by lircd 0.10.2's transmit rules"
        }
      ]
    },
    "KEY_CLEAR": {
      "forms": [
        {
          "id": "primary.raw",
          "type": "raw",
          "intro": [8960, 4200, 560, 560, 560, 1680, 560, 1680, 560, 1680, 560, 560, 560, 1680, 560, 1680, 560, 560, 560, 1680, 560, 560, 560, 560, 560, 560, 560, 1680, 560, 560, 560, 560, 560, 1680, 560, 1680, 560, 1680, 560, 1680, 560, 1680, 560, 1680, 560, 560, 560, 560, 560, 560, 560, 560, 560, 560, 560, 560, 560, 560, 560, 560, 560, 1680, 560, 1680, 560, 1680, 560, 85000],
          "repeat": [8960, 2240, 560, 85000],
          "confidence": "plausible",
          "source": "lirc-remotes@291b40f remotes/lg/VF28.lircd.conf:52 [block LG_VCR_Remote] (contributed by Adrien Beau): expanded to raw by lircd 0.10.2's transmit rules"
        }
      ]
    },
    "Skip_Commercial": {
      "forms": [
        {
          "id": "primary.raw",
          "type": "raw",
          "intro": [8960, 4200, 560, 560, 560, 1680, 560, 1680, 560, 1680, 560, 560, 560, 1680, 560, 1680, 560, 560, 560, 1680, 560, 560, 560, 560, 560, 560, 560, 1680, 560, 560, 560, 560, 560, 1680, 560, 1680, 560, 560, 560, 1680, 560, 1680, 560, 1680, 560, 560, 560, 1680, 560, 1680, 560, 560, 560, 1680, 560, 560, 560, 560, 560, 560, 560, 1680, 560, 560, 560, 560, 560, 85000],
          "repeat": [8960, 2240, 560, 85000],
          "confidence": "plausible",
          "source": "lirc-remotes@291b40f remotes/lg/VF28.lircd.conf:53 [block LG_VCR_Remote] (contributed by Adrien Beau): expanded to raw by lircd 0.10.2's transmit rules"
        }
      ]
    },
    "KEY_OK": {
      "forms": [
        {
          "id": "primary.raw",
          "type": "raw",
          "intro": [8960, 4200, 560, 560, 560, 1680, 560, 1680, 560, 1680, 560, 560, 560, 1680, 560, 1680, 560, 560, 560, 1680, 560, 560, 560, 560, 560, 560, 560, 1680, 560, 560, 560, 560, 560, 1680, 560, 560, 560, 1680, 560, 1680, 560, 1680, 560, 560, 560, 560, 560, 560, 560, 1680, 560, 1680, 560, 560, 560, 560, 560, 560, 560, 1680, 560, 1680, 560, 1680, 560, 560, 560, 85000],
          "repeat": [8960, 2240, 560, 85000],
          "confidence": "plausible",
          "source": "lirc-remotes@291b40f remotes/lg/VF28.lircd.conf:54 [block LG_VCR_Remote] (contributed by Adrien Beau): expanded to raw by lircd 0.10.2's transmit rules"
        }
      ]
    },
    "Long_Play": {
      "forms": [
        {
          "id": "primary.raw",
          "type": "raw",
          "intro": [8960, 4200, 560, 560, 560, 1680, 560, 1680, 560, 1680, 560, 560, 560, 1680, 560, 1680, 560, 560, 560, 1680, 560, 560, 560, 560, 560, 560, 560, 1680, 560, 560, 560, 560, 560, 1680, 560, 560, 560, 560, 560, 560, 560, 1680, 560, 560, 560, 560, 560, 1680, 560, 560, 560, 1680, 560, 1680, 560, 1680, 560, 560, 560, 1680, 560, 1680, 560, 560, 560, 1680, 560, 85000],
          "repeat": [8960, 2240, 560, 85000],
          "confidence": "plausible",
          "source": "lirc-remotes@291b40f remotes/lg/VF28.lircd.conf:55 [block LG_VCR_Remote] (contributed by Adrien Beau): expanded to raw by lircd 0.10.2's transmit rules"
        }
      ]
    },
    "KEY_STOP": {
      "forms": [
        {
          "id": "primary.raw",
          "type": "raw",
          "intro": [8960, 4200, 560, 560, 560, 1680, 560, 1680, 560, 1680, 560, 560, 560, 1680, 560, 1680, 560, 560, 560, 1680, 560, 560, 560, 560, 560, 560, 560, 1680, 560, 560, 560, 560, 560, 1680, 560, 1680, 560, 560, 560, 560, 560, 560, 560, 560, 560, 560, 560, 560, 560, 560, 560, 560, 560, 1680, 560, 1680, 560, 1680, 560, 1680, 560, 1680, 560, 1680, 560, 1680, 560, 85000],
          "repeat": [8960, 2240, 560, 85000],
          "confidence": "plausible",
          "source": "lirc-remotes@291b40f remotes/lg/VF28.lircd.conf:56 [block LG_VCR_Remote] (contributed by Adrien Beau): expanded to raw by lircd 0.10.2's transmit rules"
        }
      ]
    },
    "Still_Image": {
      "forms": [
        {
          "id": "primary.raw",
          "type": "raw",
          "intro": [8960, 4200, 560, 560, 560, 1680, 560, 1680, 560, 1680, 560, 560, 560, 1680, 560, 1680, 560, 560, 560, 1680, 560, 560, 560, 560, 560, 560, 560, 1680, 560, 560, 560, 560, 560, 1680, 560, 1680, 560, 1680, 560, 560, 560, 1680, 560, 560, 560, 560, 560, 560, 560, 560, 560, 560, 560, 560, 560, 1680, 560, 560, 560, 1680, 560, 1680, 560, 1680, 560, 1680, 560, 85000],
          "repeat": [8960, 2240, 560, 85000],
          "confidence": "plausible",
          "source": "lirc-remotes@291b40f remotes/lg/VF28.lircd.conf:57 [block LG_VCR_Remote] (contributed by Adrien Beau): expanded to raw by lircd 0.10.2's transmit rules"
        }
      ]
    },
    "KEY_RECORD": {
      "forms": [
        {
          "id": "primary.raw",
          "type": "raw",
          "intro": [8960, 4200, 560, 560, 560, 1680, 560, 1680, 560, 1680, 560, 560, 560, 1680, 560, 1680, 560, 560, 560, 1680, 560, 560, 560, 560, 560, 560, 560, 1680, 560, 560, 560, 560, 560, 1680, 560, 1680, 560, 560, 560, 560, 560, 1680, 560, 560, 560, 560, 560, 560, 560, 560, 560, 560, 560, 1680, 560, 1680, 560, 560, 560, 1680, 560, 1680, 560, 1680, 560, 1680, 560, 85000],
          "repeat": [8960, 2240, 560, 85000],
          "confidence": "plausible",
          "source": "lirc-remotes@291b40f remotes/lg/VF28.lircd.conf:58 [block LG_VCR_Remote] (contributed by Adrien Beau): expanded to raw by lircd 0.10.2's transmit rules"
        }
      ]
    },
    "Fast_Backward": {
      "forms": [
        {
          "id": "primary.raw",
          "type": "raw",
          "intro": [8960, 4200, 560, 560, 560, 1680, 560, 1680, 560, 1680, 560, 560, 560, 1680, 560, 1680, 560, 560, 560, 1680, 560, 560, 560, 560, 560, 560, 560, 1680, 560, 560, 560, 560, 560, 1680, 560, 560, 560, 1680, 560, 560, 560, 560, 560, 560, 560, 560, 560, 560, 560, 560, 560, 1680, 560, 560, 560, 1680, 560, 1680, 560, 1680, 560, 1680, 560, 1680, 560, 1680, 560, 85000],
          "repeat": [8960, 2240, 560, 85000],
          "confidence": "plausible",
          "source": "lirc-remotes@291b40f remotes/lg/VF28.lircd.conf:59 [block LG_VCR_Remote] (contributed by Adrien Beau): expanded to raw by lircd 0.10.2's transmit rules"
        }
      ]
    },
    "KEY_PLAY": {
      "forms": [
        {
          "id": "primary.raw",
          "type": "raw",
          "intro": [8960, 4200, 560, 560, 560, 1680, 560, 1680, 560, 1680, 560, 560, 560, 1680, 560, 1680, 560, 560, 560, 1680, 560, 560, 560, 560, 560, 560, 560, 1680, 560, 560, 560, 560, 560, 1680, 560, 560, 560, 560, 560, 560, 560, 1680, 560, 560, 560, 560, 560, 560, 560, 560, 560, 1680, 560, 1680, 560, 1680, 560, 560, 560, 1680, 560, 1680, 560, 1680, 560, 1680, 560, 85000],
          "repeat": [8960, 2240, 560, 85000],
          "confidence": "plausible",